{
  "schema_version": 4,
  "schema": "https://raw.githubusercontent.com/gfargo/tui-design-skill/main/evals/schema/v4/run.schema.json",
  "artifact_type": "tui-design-eval-run",
  "run_id": "v170-lifecycle-baseline-r3",
  "status": "completed",
  "created_at": "2026-09-09T17:41:35Z",
  "completed_at": "2026-09-09T18:01:59Z",
  "eval_set": "evals/v170-lifecycle-evals.json",
  "eval_set_sha256": "1bab1181943831a35d45acdabc7bdcdef0afa99a572813f4a84a2e79a4115945",
  "skill_dir": "plugins/tui-design/skills/tui-design",
  "skill_sha256": "8bb1f093f84be90ebb4a4a54071ff8db196afdd7ade70c50a54c769b8dcf4156",
  "condition": "baseline",
  "provider": "OpenAI Codex desktop CLI",
  "model": "gpt-5.6-terra",
  "repetitions": 3,
  "runner_executable": "codex",
  "runner_version": "codex-cli 0.147.0-alpha.6.5",
  "runner_argv": [
    "/Users/gfargo/.npm/_npx/15534def11d94151/node_modules/.bin/codex",
    "exec",
    "--ignore-user-config",
    "--ephemeral",
    "--disable",
    "skill_search",
    "--disable",
    "plugins",
    "-c",
    "skills.include_instructions=false",
    "-c",
    "skills.bundled.enabled=false",
    "-m",
    "gpt-5.6-terra",
    "-c",
    "model_reasoning_effort=\"high\"",
    "-s",
    "read-only",
    "-C",
    "/tmp/tui-design-baseline-v170",
    "--color",
    "never",
    "--skip-git-repo-check",
    "-"
  ],
  "runner_argv_recorded": true,
  "runner_argv_sha256": "7b67274d1b093fcbe64b0378a6ac33b77400bd40fcb941898191ab6c188fae6f",
  "generation": {
    "seed": null,
    "temperature": null,
    "system_prompt": {
      "status": "unavailable",
      "sha256": null,
      "bytes": null
    }
  },
  "timeout_seconds": 900.0,
  "git": {
    "commit": "63ac69f04c40ebd60308ca23d952106fd5d63677",
    "branch": "main",
    "dirty": false
  },
  "host": {
    "platform": "macOS-26.5-arm64-arm-64bit-Mach-O",
    "python": "3.14.4"
  },
  "trials": [
    {
      "trial_id": "bubble-tea-editor-handoff-r1",
      "case_id": "bubble-tea-editor-handoff",
      "case_name": "bubble-tea-editor-handoff",
      "repetition": 1,
      "prompt_file": "prompts/bubble-tea-editor-handoff-r1.txt",
      "prompt_sha256": "d24fe3167876c935dc9231d79edc913e73a3204232dc160a44c847f182d4c950",
      "status": "completed",
      "exit_code": 0,
      "duration_seconds": 103.013293,
      "response_file": "responses/bubble-tea-editor-handoff-r1.md",
      "response_sha256": "79fca546b70e91e202ecd5916cf05429d8bc6436df3ce35b0bbaa830b228f56e",
      "stderr_file": "stderr/bubble-tea-editor-handoff-r1.txt",
      "stderr_sha256": "8c3c77e6c7dd2d49bb80c041acb8f59e6ef9f070994622064ba443188a5af736"
    },
    {
      "trial_id": "bubble-tea-editor-handoff-r2",
      "case_id": "bubble-tea-editor-handoff",
      "case_name": "bubble-tea-editor-handoff",
      "repetition": 2,
      "prompt_file": "prompts/bubble-tea-editor-handoff-r2.txt",
      "prompt_sha256": "d24fe3167876c935dc9231d79edc913e73a3204232dc160a44c847f182d4c950",
      "status": "completed",
      "exit_code": 0,
      "duration_seconds": 60.29963,
      "response_file": "responses/bubble-tea-editor-handoff-r2.md",
      "response_sha256": "3ddad698e54161d1493893562f86fcd3e209f0a178f8acde570c07e78eb15ddd",
      "stderr_file": "stderr/bubble-tea-editor-handoff-r2.txt",
      "stderr_sha256": "bd73bed9464690726482811888d34bbcc67e87d9359e09fe8ca7a1dbcb720d00"
    },
    {
      "trial_id": "bubble-tea-editor-handoff-r3",
      "case_id": "bubble-tea-editor-handoff",
      "case_name": "bubble-tea-editor-handoff",
      "repetition": 3,
      "prompt_file": "prompts/bubble-tea-editor-handoff-r3.txt",
      "prompt_sha256": "d24fe3167876c935dc9231d79edc913e73a3204232dc160a44c847f182d4c950",
      "status": "completed",
      "exit_code": 0,
      "duration_seconds": 85.860469,
      "response_file": "responses/bubble-tea-editor-handoff-r3.md",
      "response_sha256": "5dbf3fc725b8a6e3ee88bb1aed86bc5b16e6689397a8112a68e379ac4d38271c",
      "stderr_file": "stderr/bubble-tea-editor-handoff-r3.txt",
      "stderr_sha256": "247cd77cdf7446765ddc0634f0626d964deac59ef0494240707a102d17a0cfa0"
    },
    {
      "trial_id": "ratatui-editor-reader-r1",
      "case_id": "ratatui-editor-reader",
      "case_name": "ratatui-editor-reader-handoff",
      "repetition": 1,
      "prompt_file": "prompts/ratatui-editor-reader-r1.txt",
      "prompt_sha256": "0bc9ee22053af24f641346d5dcb7620fd808e73ff96520bfbb4c8faab89cba95",
      "status": "completed",
      "exit_code": 0,
      "duration_seconds": 54.348126,
      "response_file": "responses/ratatui-editor-reader-r1.md",
      "response_sha256": "91dfd3cfba2d87d999e4a592d14405decabb3728b9d025713cb833a36e414105",
      "stderr_file": "stderr/ratatui-editor-reader-r1.txt",
      "stderr_sha256": "052626728f7833720606759c05197fcf5ee23160e07f67848a73a42f6adc4143"
    },
    {
      "trial_id": "ratatui-editor-reader-r2",
      "case_id": "ratatui-editor-reader",
      "case_name": "ratatui-editor-reader-handoff",
      "repetition": 2,
      "prompt_file": "prompts/ratatui-editor-reader-r2.txt",
      "prompt_sha256": "0bc9ee22053af24f641346d5dcb7620fd808e73ff96520bfbb4c8faab89cba95",
      "status": "completed",
      "exit_code": 0,
      "duration_seconds": 94.510262,
      "response_file": "responses/ratatui-editor-reader-r2.md",
      "response_sha256": "0b9a9b8a4e5f6d584ed5c8043dc3c27b9e1e5b271d2e765071d81c5ad7bbb69b",
      "stderr_file": "stderr/ratatui-editor-reader-r2.txt",
      "stderr_sha256": "ec2e45c3f6419ed52481b171ae57d710084780fd70ea9592361f5e2b5fb93c4e"
    },
    {
      "trial_id": "ratatui-editor-reader-r3",
      "case_id": "ratatui-editor-reader",
      "case_name": "ratatui-editor-reader-handoff",
      "repetition": 3,
      "prompt_file": "prompts/ratatui-editor-reader-r3.txt",
      "prompt_sha256": "0bc9ee22053af24f641346d5dcb7620fd808e73ff96520bfbb4c8faab89cba95",
      "status": "completed",
      "exit_code": 0,
      "duration_seconds": 74.182993,
      "response_file": "responses/ratatui-editor-reader-r3.md",
      "response_sha256": "79fba6202f918930fdb084bbd87eb1061c9a5b26a342ad6d8ff6df410f4813da",
      "stderr_file": "stderr/ratatui-editor-reader-r3.txt",
      "stderr_sha256": "954e0203b51ae73e1062c7f4300e8b65ab8fa62d3340ed88ff1a7863feb04378"
    },
    {
      "trial_id": "textual-portable-suspension-r1",
      "case_id": "textual-portable-suspension",
      "case_name": "textual-portable-suspension",
      "repetition": 1,
      "prompt_file": "prompts/textual-portable-suspension-r1.txt",
      "prompt_sha256": "3b457a276d479bfbdcf526602e7e6194da90a8d76e376985a12477a19c43421f",
      "status": "completed",
      "exit_code": 0,
      "duration_seconds": 76.48733,
      "response_file": "responses/textual-portable-suspension-r1.md",
      "response_sha256": "d97abecb09eb8b7b570ea8510e986d5ff5680c4b39df17776a17b1824b290eb9",
      "stderr_file": "stderr/textual-portable-suspension-r1.txt",
      "stderr_sha256": "c6af09f87ff4b0ae216ba2bcd7e850cbc0b542516a7cf765f0ebccebfc8a0450"
    },
    {
      "trial_id": "textual-portable-suspension-r2",
      "case_id": "textual-portable-suspension",
      "case_name": "textual-portable-suspension",
      "repetition": 2,
      "prompt_file": "prompts/textual-portable-suspension-r2.txt",
      "prompt_sha256": "3b457a276d479bfbdcf526602e7e6194da90a8d76e376985a12477a19c43421f",
      "status": "completed",
      "exit_code": 0,
      "duration_seconds": 85.731928,
      "response_file": "responses/textual-portable-suspension-r2.md",
      "response_sha256": "a0d86cc9ecadd4e73cab0aa93494762d3bf8f6df19b3df39c1c960ecc02b6c53",
      "stderr_file": "stderr/textual-portable-suspension-r2.txt",
      "stderr_sha256": "60e567c1516510d85222ea6eff19fe46ef26bd6afd0fcf8e7e0a35647fd71467"
    },
    {
      "trial_id": "textual-portable-suspension-r3",
      "case_id": "textual-portable-suspension",
      "case_name": "textual-portable-suspension",
      "repetition": 3,
      "prompt_file": "prompts/textual-portable-suspension-r3.txt",
      "prompt_sha256": "3b457a276d479bfbdcf526602e7e6194da90a8d76e376985a12477a19c43421f",
      "status": "completed",
      "exit_code": 0,
      "duration_seconds": 66.86014,
      "response_file": "responses/textual-portable-suspension-r3.md",
      "response_sha256": "677f0a5c14e42eebe2da48602277e3f539e2ee618f0e6177b4c22605fadf3541",
      "stderr_file": "stderr/textual-portable-suspension-r3.txt",
      "stderr_sha256": "9533cfc178f61a72372248bd0548a46ad588baf174687995be8beb19a5493b7b"
    },
    {
      "trial_id": "ink-suspend-terminal-r1",
      "case_id": "ink-suspend-terminal",
      "case_name": "ink-suspend-terminal",
      "repetition": 1,
      "prompt_file": "prompts/ink-suspend-terminal-r1.txt",
      "prompt_sha256": "a2687fbc630cc306573ab56f917738f9431314a640462ec3b799abdbedad788a",
      "status": "completed",
      "exit_code": 0,
      "duration_seconds": 67.826342,
      "response_file": "responses/ink-suspend-terminal-r1.md",
      "response_sha256": "5da12eeabb9eaa1a269db933280d24dd9c973c633765e0a6a1f5b4499d990443",
      "stderr_file": "stderr/ink-suspend-terminal-r1.txt",
      "stderr_sha256": "0c7c8d0c7bba5ebe773093e579f93889bc28570c0c6d243604d82715f64377f3"
    },
    {
      "trial_id": "ink-suspend-terminal-r2",
      "case_id": "ink-suspend-terminal",
      "case_name": "ink-suspend-terminal",
      "repetition": 2,
      "prompt_file": "prompts/ink-suspend-terminal-r2.txt",
      "prompt_sha256": "a2687fbc630cc306573ab56f917738f9431314a640462ec3b799abdbedad788a",
      "status": "completed",
      "exit_code": 0,
      "duration_seconds": 81.854752,
      "response_file": "responses/ink-suspend-terminal-r2.md",
      "response_sha256": "30e8124e5409d0c8548dc16f4f14826e1e2051165660bf58b7485c8f0d69254d",
      "stderr_file": "stderr/ink-suspend-terminal-r2.txt",
      "stderr_sha256": "4c00312e5498070e8fe3c3cfe4938267dd571b6d2f25c50eccca5f315cfeec0f"
    },
    {
      "trial_id": "ink-suspend-terminal-r3",